{
	"$schema": "https://misojs.dev/miso.schema.json",
	"scripts": "./scripts",
	"shell": "bash",
	"tui": "tabbed",
	"repo": {
		"tasks": {
			"build": { "dependsOn": ["^build"] },
			"dev": { "concurrent": ["services", "db:studio"] }
		}
	},
	"flags": {
		"add": ["--dev"],
		"install": ["--frozen-lockfile"]
	},
	"env": [
		{
			"scope": "web",
			"label": "web",
			"path": "apps/web/.env.local",
			"variables": {
				"PORT": "port",
				"DATABASE_URL": "url",
				"API_KEY": {
					"type": "string",
					"min": 1,
					"max": 32
				},
				"ADMIN_EMAIL": "email",
				"DEBUG_MODE": "bool",
				"FEATURE_FLAGS": "json"
			}
		},
		{
			"scope": "api",
			"label": "api",
			"path": "apps/api/.env",
			"required": "all",
			"variables": {
				"NODE_ENV": {
					"type": "enum",
					"values": ["development", "production", "test"],
					"optional": true
				},
				"REDIS_URL": {
					"type": "url",
					"schemes": ["redis", "rediss"]
				},
				"RATE_LIMIT": {
					"type": "int+",
					"min": 1,
					"max": 1000
				},
				"USER_ID": "uuid",
				"SLUG": {
					"type": "pattern",
					"pattern": "^[a-z0-9-]+$"
				}
			}
		}
	]
}
